{
  "argv": [
    "/opt/lean-eval/bin/sokonanoda",
    "/run/lean-eval/nanoda-config.json"
  ],
  "attempt_id": "kca1_6666666666666666666666666666666666666666666666666666666666666666",
  "attempt_identity_qualification": "unbound",
  "checker": {
    "binary_sha256": "7777777777777777777777777777777777777777777777777777777777777777",
    "binary_qualification": "unqualified",
    "commit": "3d7585c21242f29fdaa48ae9a16e16c6afe42238",
    "executable": "/opt/lean-eval/bin/sokonanoda",
    "name": "mathgraph",
    "protocol": "nanoda_config_file_v1",
    "repository": "metalogiclabs/mathgraph-lean-kernel"
  },
  "configuration": {
    "export_file_path": "/run/lean-eval/solution-export.ndjson",
    "nat_extension": true,
    "permitted_axioms": [
      "Classical.choice",
      "propext"
    ],
    "string_extension": true,
    "unpermitted_axiom_hard_error": true,
    "use_stdin": false
  },
  "configuration_path": "/run/lean-eval/nanoda-config.json",
  "configuration_sha256": "284518cf96122e256ca29201d4942e4f2d8a63a45265df298c33d37ab062b885",
  "environment": {},
  "export_metadata_sha256": "69466b17f02a9795454b89379a23e53ab6fd283e6301021bbfd5367cf13c5be9",
  "input_path": "/run/lean-eval/solution-export.ndjson",
  "input_sha256": "7d1ca64c0b12707ed286aab6fefbd3fde2301baf72712e83bcc4981105ef1afd",
  "kind": "kernel_nanoda_invocation",
  "outcome_protocol": {
    "accepted_exit_code": 0,
    "ambiguous_exit_codes": [
      1
    ],
    "blocking_reason": "candidate_exit_1_conflates_rejection_and_internal_failure",
    "declined_exit_code": 2,
    "name": "mathgraph_nanoda_exit_v1",
    "rejected_exit_codes": [],
    "source_path": "src/main.rs",
    "source_sha256": "c38ff157412ff9d494c282cf47d9e5059ab35b32c35dc6f74548f9e40c5be166"
  },
  "resource_limits": {
    "max_memory_bytes": 8589934592,
    "wall_timeout_ms": 600000
  },
  "schema_version": 1
}
